Poster_Link,Series_Title,Released_Year,Certificate,Runtime,Genre,IMDB_Rating,Overview,Meta_score,Director,Star1,Star2,Star3,Star4,No_of_Votes,Gross
"https://m.media-amazon.com/images/M/MV5BNjA2ZDY3ZjYtZmNiMC00MDU5LTgxMWEtNzk1YmI3NzdkMTU0XkEyXkFqcGdeQXVyNjQyMjcwNDM@._V1_UX67_CR0,0,67,98_AL_.jpg",Fear and Loathing in Las Vegas,1998,R,118 min,"Adventure, Comedy, Drama",7.6,An oddball journalist and his psychopathic lawyer travel to Las Vegas for a series of psychedelic escapades.,41,Terry Gilliam,Johnny Depp,Benicio Del Toro,Tobey Maguire,Michael Lee Gogin,259753,"10,680,275"
"https://m.media-amazon.com/images/M/MV5BMTkyNTAzZDYtNWUzYi00ODVjLTliZjYtNjc2YzJmODZhNTg3XkEyXkFqcGdeQXVyNjUxMDQ0MTg@._V1_UY98_CR6,0,67,98_AL_.jpg",Funny Games,1997,A,108 min,"Crime, Drama, Thriller",7.6,"Two violent young men take a mother, father, and son hostage in their vacation cabin and force them to play sadistic ""games"" with one another for their own amusement.",69,Michael Haneke,Susanne Lothar,Ulrich Mühe,Arno Frisch,Frank Giering,65058,
"https://m.media-amazon.com/images/M/MV5BMGExOGExM2UtNWM5ZS00OWEzLTllNzYtM2NlMTJlYjBlZTJkXkEyXkFqcGdeQXVyMTQxNzMzNDI@._V1_UX67_CR0,0,67,98_AL_.jpg",Dark City,1998,A,100 min,"Mystery, Sci-Fi, Thriller",7.6,"A man struggles with memories of his past, which include a wife he cannot remember and a nightmarish world no one else ever seems to wake up from.",66,Alex Proyas,Rufus Sewell,Kiefer Sutherland,Jennifer Connelly,William Hurt,187927,"14,378,331"
"https://m.media-amazon.com/images/M/MV5BMzk1MmI4NzAtOGRiNS00YjY1LTllNmEtZDhiZDM4MjU2NTMxXkEyXkFqcGdeQXVyNjc3MjQzNTI@._V1_UY98_CR1,0,67,98_AL_.jpg",Sleepers,1996,UA,147 min,"Crime, Drama, Thriller",7.6,"After a prank goes disastrously wrong, a group of boys are sent to a detention center where they are brutalized. Thirteen years later, an unexpected random encounter with a former guard gives them a chance for revenge.",49,Barry Levinson,Robert De Niro,Kevin Bacon,Brad Pitt,Jason Patric,186734,"49,100,000"
"https://m.media-amazon.com/images/M/MV5BYWUxOWY4NDctMDFmMS00ZTQwLWExMGEtODg0ZWNhOTE5NzZmXkEyXkFqcGdeQXVyMTQxNzMzNDI@._V1_UY98_CR0,0,67,98_AL_.jpg",Lost Highway,1997,A,134 min,"Mystery, Thriller",7.6,"Anonymous videotapes presage a musician's murder conviction, and a gangster's girlfriend leads a mechanic astray.",52,David Lynch,Bill Pullman,Patricia Arquette,John Roselius,Louis Eppolito,131101,"3,796,699"
"https://m.media-amazon.com/images/M/MV5BNzk1MjU3MDQyMl5BMl5BanBnXkFtZTcwNjc1OTM2MQ@@._V1_UX67_CR0,0,67,98_AL_.jpg",Sense and Sensibility,1995,U,136 min,"Drama, Romance",7.6,"Rich Mr. Dashwood dies, leaving his second wife and her three daughters poor by the rules of inheritance. The two eldest daughters are the title opposites.",84,Ang Lee,Emma Thompson,Kate Winslet,James Fleet,Tom Wilkinson,102598,"43,182,776"
"https://m.media-amazon.com/images/M/MV5BZjI0ZWFiMmQtMjRlZi00ZmFhLWI4NmYtMjQ5YmY0MzIyMzRiXkEyXkFqcGdeQXVyMTQxNzMzNDI@._V1_UX67_CR0,0,67,98_AL_.jpg",Die Hard: With a Vengeance,1995,A,128 min,"Action, Adventure, Thriller",7.6,"John McClane and a Harlem store owner are targeted by German terrorist Simon in New York City, where he plans to rob the Federal Reserve Building.",58,John McTiernan,Bruce Willis,Jeremy Irons,Samuel L. Jackson,Graham Greene,364420,"100,012,499"
"https://m.media-amazon.com/images/M/MV5BYTJlZmQ1OTAtODQzZi00NGIzLWI1MmEtZGE4NjFlOWRhODIyXkEyXkFqcGdeQXVyNTc1NTQxODI@._V1_UY98_CR0,0,67,98_AL_.jpg",Dead Man,1995,R,121 min,"Adventure, Drama, Fantasy",7.6,"On the run after murdering a man, accountant William Blake encounters a strange aboriginal American man named Nobody who prepares him for his journey into the spiritual world.",62,Jim Jarmusch,Johnny Depp,Gary Farmer,Crispin Glover,Lance Henriksen,90442,"1,037,847"
"https://m.media-amazon.com/images/M/MV5BNmRiZDZkN2EtNWI5ZS00ZDg3LTgyNDItMWI5NjVlNmE5ODJiXkEyXkFqcGdeQXVyMjQwMjk0NjI@._V1_UX67_CR0,0,67,98_AL_.jpg",The Bridges of Madison County,1995,A,135 min,"Drama, Romance",7.6,Photographer Robert Kincaid wanders into the life of housewife Francesca Johnson for four days in the 1960s.,69,Clint Eastwood,Clint Eastwood,Meryl Streep,Annie Corley,Victor Slezak,73172,"71,516,617"
"https://m.media-amazon.com/images/M/MV5BNjEzYjJmNzgtNDkwNy00MTQ4LTlmMWMtNzA4YjE2NjI0ZDg4XkEyXkFqcGdeQXVyNjU0OTQ0OTY@._V1_UX67_CR0,0,67,98_AL_.jpg",Apollo 13,PG,U,140 min,"Adventure, Drama, History",7.6,NASA must devise a strategy to return Apollo 13 to Earth safely after the spacecraft undergoes massive internal damage putting the lives of the three astronauts on board in jeopardy.,77,Ron Howard,Tom Hanks,Bill Paxton,Kevin Bacon,Gary Sinise,269197,"173,837,933"
"https://m.media-amazon.com/images/M/MV5BNTliYTI1YTctMTE0Mi00NDM0LThjZDgtYmY3NGNiODBjZjAwXkEyXkFqcGdeQXVyMTAwMzUyOTc@._V1_UX67_CR0,0,67,98_AL_.jpg",Trois couleurs: Blanc,1994,U,92 min,"Comedy, Drama, Romance",7.6,"After his wife divorces him, a Polish immigrant plots to get even with her.",88,Krzysztof Kieslowski,Zbigniew Zamachowski,Julie Delpy,Janusz Gajos,Jerzy Stuhr,64390,"1,464,625"
"https://m.media-amazon.com/images/M/MV5BYjcxMzM3OWMtNmM3Yy00YzBkLTkxMmQtMDk4MmM3Y2Y4MDliL2ltYWdlXkEyXkFqcGdeQXVyMTQxNzMzNDI@._V1_UX67_CR0,0,67,98_AL_.jpg",Falling Down,1993,R,113 min,"Action, Crime, Drama",7.6,An ordinary man frustrated with the various flaws he sees in society begins to psychotically and violently lash out against them.,56,Joel Schumacher,Michael Douglas,Robert Duvall,Barbara Hershey,Rachel Ticotin,171640,"40,903,593"
"https://m.media-amazon.com/images/M/MV5BMTM5MDY5MDQyOV5BMl5BanBnXkFtZTgwMzM3NzMxMDE@._V1_UX67_CR0,0,67,98_AL_.jpg",Dazed and Confused,1993,U,102 min,Comedy,7.6,The adventures of high school and junior high students on the last day of school in May 1976.,78,Richard Linklater,Jason London,Wiley Wiggins,Matthew McConaughey,Rory Cochrane,165465,"7,993,039"
"https://m.media-amazon.com/images/M/MV5BMTQxNDYzMTg1M15BMl5BanBnXkFtZTgwNzk4MDgxMTE@._V1_UX67_CR0,0,67,98_AL_.jpg",My Cousin Vinny,1992,UA,120 min,"Comedy, Crime",7.6,"Two New Yorkers accused of murder in rural Alabama while on their way back to college call in the help of one of their cousins, a loudmouth lawyer with no trial experience.",68,Jonathan Lynn,Joe Pesci,Marisa Tomei,Ralph Macchio,Mitchell Whitfield,107325,"52,929,168"
"https://m.media-amazon.com/images/M/MV5BMTY5NjI2MjQxMl5BMl5BanBnXkFtZTgwMDA2MzM2NzE@._V1_UY98_CR0,0,67,98_AL_.jpg",Omohide poro poro,1991,U,118 min,"Animation, Drama, Romance",7.6,A twenty-seven-year-old office worker travels to the countryside while reminiscing about her childhood in Tokyo.,90,Isao Takahata,Miki Imai,Toshirô Yanagiba,Yoko Honna,Mayumi Izuka,27071,"453,243"
"https://m.media-amazon.com/images/M/MV5BNjg5ZDM0MTEtYTZmNC00NDJiLWI5MTktYzk4N2QxY2IxZTc2L2ltYWdlXkEyXkFqcGdeQXVyNTAyODkwOQ@@._V1_UY98_CR3,0,67,98_AL_.jpg",Delicatessen,1991,R,99 min,"Comedy, Crime",7.6,Post-apocalyptic surrealist black comedy about the landlord of an apartment building who occasionally prepares a delicacy for his odd tenants.,66,Marc Caro,Jean-Pierre Jeunet,Marie-Laure Dougnac,Dominique Pinon,Pascal Benezech,80487,"1,794,187"
"https://m.media-amazon.com/images/M/MV5BMzFkM2YwOTQtYzk2Mi00N2VlLWE3NTItN2YwNDg1YmY0ZDNmXkEyXkFqcGdeQXVyMTMxODk2OTU@._V1_UX67_CR0,0,67,98_AL_.jpg",Home Alone,1990,U,103 min,"Comedy, Family",7.6,An eight-year-old troublemaker must protect his house from a pair of burglars when he is accidentally left home alone by his family during Christmas vacation.,63,Chris Columbus,Macaulay Culkin,Joe Pesci,Daniel Stern,John Heard,488817,"285,761,243"
"https://m.media-amazon.com/images/M/MV5BNWFlYWY2YjYtNjdhNi00MzVlLTg2MTMtMWExNzg4NmM5NmEzXkEyXkFqcGdeQXVyMDk5Mzc5MQ@@._V1_UX67_CR0,0,67,98_AL_.jpg",The Godfather: Part III,1990,A,162 min,"Crime, Drama",7.6,"Follows Michael Corleone, now in his 60s, as he seeks to free his family from crime and find a suitable successor to his empire.",60,Francis Ford Coppola,Al Pacino,Diane Keaton,Andy Garcia,Talia Shire,359809,"66,666,062"
"https://m.media-amazon.com/images/M/MV5BMjE0ODEwNjM2NF5BMl5BanBnXkFtZTcwMjU2Mzg3NA@@._V1_UX67_CR0,0,67,98_AL_.jpg",When Harry Met Sally...,1989,UA,95 min,"Comedy, Drama, Romance",7.6,"Harry and Sally have known each other for years, and are very good friends, but they fear sex would ruin the friendship.",76,Rob Reiner,Billy Crystal,Meg Ryan,Carrie Fisher,Bruno Kirby,195663,"92,823,600"
"https://m.media-amazon.com/images/M/MV5BN2JlZTBhYTEtZDE3OC00NTA3LTk5NTQtNjg5M2RjODllM2M0XkEyXkFqcGdeQXVyNjk1Njg5NTA@._V1_UX67_CR0,0,67,98_AL_.jpg",The Little Mermaid,1989,U,83 min,"Animation, Family, Fantasy",7.6,A mermaid princess makes a Faustian bargain in an attempt to become human and win a prince's love.,88,Ron Clements,John Musker,Jodi Benson,Samuel E. Wright,Rene Auberjonois,237696,"111,543,479"
"https://m.media-amazon.com/images/M/MV5BODk1ZWM4ZjItMjFhZi00MDMxLTgxNmYtODFhNWZlZTkwM2UwXkEyXkFqcGdeQXVyMTQxNzMzNDI@._V1_UX67_CR0,0,67,98_AL_.jpg",The Naked Gun: From the Files of Police Squad!,1988,U,85 min,"Comedy, Crime",7.6,Incompetent police Detective Frank Drebin must foil an attempt to assassinate Queen Elizabeth II.,76,David Zucker,Leslie Nielsen,Priscilla Presley,O.J. Simpson,Ricardo Montalban,152871,"78,756,177"
"https://m.media-amazon.com/images/M/MV5BM2I1ZWNkYjEtYWY3ZS00MmMwLWI5OTEtNWNkZjNiYjIwNzY0XkEyXkFqcGdeQXVyNTI4MjkwNjA@._V1_UX67_CR0,0,67,98_AL_.jpg","Planes, Trains & Automobiles",1987,U,93 min,"Comedy, Drama",7.6,A man must struggle to travel home for Thanksgiving with a lovable oaf of a shower curtain ring salesman as his only companion.,72,John Hughes,Steve Martin,John Candy,Laila Robins,Michael McKean,124773,"49,530,280"
"https://m.media-amazon.com/images/M/MV5BZTllNWNlZjctMWQwMS00ZDc3LTg5ZjMtNzhmNzhjMmVhYTFlXkEyXkFqcGdeQXVyNTc1NTQxODI@._V1_UX67_CR0,0,67,98_AL_.jpg",Lethal Weapon,1987,A,109 min,"Action, Crime, Thriller",7.6,Two newly paired cops who are complete opposites must put aside their differences in order to catch a gang of drug smugglers.,68,Richard Donner,Mel Gibson,Danny Glover,Gary Busey,Mitchell Ryan,236894,"65,207,127"
"https://m.media-amazon.com/images/M/MV5BZmI5YzM1MjItMzFmNy00NGFkLThlMDUtZjZmYTZkM2QxMjU3XkEyXkFqcGdeQXVyNzkwMjQ5NzM@._V1_UX67_CR0,0,67,98_AL_.jpg",Blood Simple,1984,A,99 min,"Crime, Drama, Thriller",7.6,"The owner of a seedy small-town Texas bar discovers that one of his employees is having an affair with his wife. A chaotic chain of misunderstandings, lies and mischief ensues after he devises a plot to have them murdered.",82,Joel Coen,Ethan Coen,John Getz,Frances McDormand,Dan Hedaya,87745,"2,150,000"
"https://m.media-amazon.com/images/M/MV5BNWQ4MGZlZmYtZjY0MS00N2JhLWE0NmMtOTMwMTk4NDQ4NjE2XkEyXkFqcGdeQXVyNTI4MjkwNjA@._V1_UX67_CR0,0,67,98_AL_.jpg",On Golden Pond,1981,UA,109 min,Drama,7.6,"Norman is a curmudgeon with an estranged relationship with his daughter Chelsea. At Golden Pond, he and his wife nevertheless agree to care for Billy, the son of Chelsea's new boyfriend, and a most unexpected relationship blooms.",68,Mark Rydell,Katharine Hepburn,Henry Fonda,Jane Fonda,Doug McKeon,27650,"119,285,432"
"https://m.media-amazon.com/images/M/MV5BN2VlNjNhZWQtMTY2OC00Y2E1LWJkNGUtMDU4M2ViNzliMGYwXkEyXkFqcGdeQXVyNTAyODkwOQ@@._V1_UX67_CR0,0,67,98_AL_.jpg",Mad Max 2,1981,A,96 min,"Action, Adventure, Sci-Fi",7.6,"In the post-apocalyptic Australian wasteland, a cynical drifter agrees to help a small, gasoline-rich community escape a horde of bandits.",77,George Miller,Mel Gibson,Bruce Spence,Michael Preston,Max Phipps,166588,"12,465,371"
"https://m.media-amazon.com/images/M/MV5BYTU2MWRiMTMtYzAzZi00NGYzLTlkMDEtNWQ3MzZlNTJlNzZkL2ltYWdlL2ltYWdlXkEyXkFqcGdeQXVyNjc1NTYyMjg@._V1_UX67_CR0,0,67,98_AL_.jpg",The Warriors,1979,UA,92 min,"Action, Crime, Thriller",7.6,"In the near future, a charismatic leader summons the street gangs of New York City in a bid to take it over. When he is killed, The Warriors are falsely blamed and now must fight their way home while every other gang is hunting them down.",65,Walter Hill,Michael Beck,James Remar,Dorsey Wright,Brian Tyler,93878,"22,490,039"
"https://m.media-amazon.com/images/M/MV5BMGQ0OGM5YjItYzYyMi00NmVmLWI3ODMtMTY2NGRkZmI5MWU2XkEyXkFqcGdeQXVyMzI0NDc4ODY@._V1_UX67_CR0,0,67,98_AL_.jpg",The Muppet Movie,1979,U,95 min,"Adventure, Comedy, Family",7.6,"Kermit and his newfound friends trek across America to find success in Hollywood, but a frog legs merchant is after Kermit.",74,James Frawley,Jim Henson,Frank Oz,Jerry Nelson,Richard Hunt,32802,"76,657,000"
"https://m.media-amazon.com/images/M/MV5BNDQ3MzNjMDItZjE0ZS00ZTYxLTgxNTAtM2I4YjZjNWFjYjJlL2ltYWdlXkEyXkFqcGdeQXVyNTAyODkwOQ@@._V1_UX67_CR0,0,67,98_AL_.jpg",Escape from Alcatraz,1979,A,112 min,"Action, Biography, Crime",7.6,"Alcatraz is the most secure prison of its time. It is believed that no one can ever escape from it, until three daring men make a possible successful attempt at escaping from one of the most infamous prisons in the world.",76,Don Siegel,Clint Eastwood,Patrick McGoohan,Roberts Blossom,Jack Thibeau,121731,"43,000,000"
"https://m.media-amazon.com/images/M/MV5BMzZiODUwNzktNzBiZi00MDc4LThkMGMtZmE3MTE0M2E1MTM3L2ltYWdlXkEyXkFqcGdeQXVyNTAyODkwOQ@@._V1_UX67_CR0,0,67,98_AL_.jpg",Watership Down,1978,U,91 min,"Animation, Adventure, Drama",7.6,"Hoping to escape destruction by human developers and save their community, a colony of rabbits, led by Hazel and Fiver, seek out a safe place to set up a new warren.",64,Martin Rosen,John Hubley,John Hurt,Richard Briers,Ralph Richardson,33656,
"https://m.media-amazon.com/images/M/MV5BNDU1MjQ0YWMtMWQ2MS00NTdmLTg1MGItNDA5NTNkNTRhOTIyXkEyXkFqcGdeQXVyNTIzOTk5ODM@._V1_UX67_CR0,0,67,98_AL_.jpg",Midnight Express,1978,A,121 min,"Biography, Crime, Drama",7.6,"Billy Hayes, an American college student, is caught smuggling drugs out of Turkey and thrown into prison.",59,Alan Parker,Brad Davis,Irene Miracle,Bo Hopkins,Paolo Bonacelli,73662,"35,000,000"
"https://m.media-amazon.com/images/M/MV5BMjM1NjE5NjQxN15BMl5BanBnXkFtZTgwMjYzMzQxMDE@._V1_UX67_CR0,0,67,98_AL_.jpg",Close Encounters of the Third Kind,1977,U,138 min,"Drama, Sci-Fi",7.6,"Roy Neary, an electric lineman, watches how his quiet and ordinary daily life turns upside down after a close encounter with a UFO.",90,Steven Spielberg,Richard Dreyfuss,François Truffaut,Teri Garr,Melinda Dillon,184966,"132,088,635"
"https://m.media-amazon.com/images/M/MV5BYzZhODNiOWYtMmNkNS00OTFhLTkzYzktYTQ4ZmNmZWMyN2ZiL2ltYWdlL2ltYWdlXkEyXkFqcGdeQXVyNjc1NTYyMjg@._V1_UX67_CR0,0,67,98_AL_.jpg",The Long Goodbye,1973,A,112 min,"Comedy, Crime, Drama",7.6,"Private investigator Philip Marlowe helps a friend out of a jam, but in doing so gets implicated in his wife's murder.",87,Robert Altman,Elliott Gould,Nina van Pallandt,Sterling Hayden,Mark Rydell,26337,"959,000"
"https://m.media-amazon.com/images/M/MV5BYjRmY2VjN2ItMzBmYy00YTRjLWFiMTgtNGZhNWJjMjk3YjZjXkEyXkFqcGdeQXVyNjc1NTYyMjg@._V1_UX67_CR0,0,67,98_AL_.jpg",Giù la testa,1971,PG,157 min,"Drama, War, Western",7.6,A low-life bandit and an I.R.A. explosives expert rebel against the government and become heroes of the Mexican Revolution.,77,Sergio Leone,Rod Steiger,James Coburn,Romolo Valli,Maria Monti,30144,"696,690"
"https://m.media-amazon.com/images/M/MV5BMzAyNDUwYzUtN2NlMC00ODliLWExMjgtMGMzNmYzZmUwYTg1XkEyXkFqcGdeQXVyNjc1NTYyMjg@._V1_UX67_CR0,0,67,98_AL_.jpg",Kelly's Heroes,1970,GP,144 min,"Adventure, Comedy, War",7.6,A group of U.S. soldiers sneaks across enemy lines to get their hands on a secret stash of Nazi treasure.,50,Brian G. Hutton,Clint Eastwood,Telly Savalas,Don Rickles,Carroll O'Connor,45338,"1,378,435"
"https://m.media-amazon.com/images/M/MV5BMjAwMTExODExNl5BMl5BanBnXkFtZTgwMjM2MDgyMTE@._V1_UX67_CR0,0,67,98_AL_.jpg",The Jungle Book,1967,U,78 min,"Animation, Adventure, Family",7.6,Bagheera the Panther and Baloo the Bear have a difficult time trying to convince a boy to leave the jungle for human civilization.,65,Wolfgang Reitherman,Phil Harris,Sebastian Cabot,Louis Prima,Bruce Reitherman,166409,"141,843,612"
"https://m.media-amazon.com/images/M/MV5BYTE4YWU0NjAtMjNiYi00MTNiLTgwYzctZjk0YjY5NGVhNWQwXkEyXkFqcGdeQXVyMTY5Nzc4MDY@._V1_UY98_CR0,0,67,98_AL_.jpg",Blowup,1966,A,111 min,"Drama, Mystery, Thriller",7.6,A fashion photographer unknowingly captures a death on film after following two lovers in a park.,82,Michelangelo Antonioni,David Hemmings,Vanessa Redgrave,Sarah Miles,John Castle,56513,
"https://m.media-amazon.com/images/M/MV5BZjQyMGUwNzAtNTc2MC00Y2FjLThlM2ItZGRjNzM0OWVmZGYyXkEyXkFqcGdeQXVyNjc1NTYyMjg@._V1_UX67_CR0,0,67,98_AL_.jpg",A Hard Day's Night,1964,U,87 min,"Comedy, Music, Musical",7.6,"Over two ""typical"" days in the life of The Beatles, the boys struggle to keep themselves and Sir Paul McCartney's mischievous grandfather in check while preparing for a live television performance.",96,Richard Lester,John Lennon,Paul McCartney,George Harrison,Ringo Starr,40351,"13,780,024"
"https://m.media-amazon.com/images/M/MV5BNGEwMTRmZTQtMDY4Ni00MTliLTk5ZmMtOWMxYWMyMTllMDg0L2ltYWdlL2ltYWdlXkEyXkFqcGdeQXVyNjc1NTYyMjg@._V1_UX67_CR0,0,67,98_AL_.jpg",Breakfast at Tiffany's,1961,A,115 min,"Comedy, Drama, Romance",7.6,"A young New York socialite becomes interested in a young man who has moved into her apartment building, but her past threatens to get in the way.",76,Blake Edwards,Audrey Hepburn,George Peppard,Patricia Neal,Buddy Ebsen,166544,
"https://m.media-amazon.com/images/M/MV5BODk3YjdjZTItOGVhYi00Mjc2LTgzMDAtMThmYTVkNTBlMWVkXkEyXkFqcGdeQXVyNDY2MTk1ODk@._V1_UX67_CR0,0,67,98_AL_.jpg",Giant,1956,G,201 min,"Drama, Western",7.6,Sprawling epic covering the life of a Texas cattle rancher and his family and associates.,84,George Stevens,Elizabeth Taylor,Rock Hudson,James Dean,Carroll Baker,34075,
"https://m.media-amazon.com/images/M/MV5BM2U3YzkxNGMtYWE0YS00ODk0LTk1ZGEtNjk3ZTE0MTk4MzJjXkEyXkFqcGdeQXVyNDk0MDg4NDk@._V1_UX67_CR0,0,67,98_AL_.jpg",From Here to Eternity,1953,Passed,118 min,"Drama, Romance, War",7.6,"In Hawaii in 1941, a private is cruelly punished for not boxing on his unit's team, while his captain's wife and second-in-command are falling in love.",85,Fred Zinnemann,Burt Lancaster,Montgomery Clift,Deborah Kerr,Donna Reed,43374,"30,500,000"
"https://m.media-amazon.com/images/M/MV5BZTBmMjUyMjItYTM4ZS00MjAwLWEyOGYtYjMyZTUxN2I3OTMxXkEyXkFqcGdeQXVyNjc1NTYyMjg@._V1_UX67_CR0,0,67,98_AL_.jpg",Lifeboat,1944,,97 min,"Drama, War",7.6,Several survivors of a torpedoed merchant ship in World War II find themselves in the same lifeboat with one of the crew members of the U-boat that sank their ship.,78,Alfred Hitchcock,Tallulah Bankhead,John Hodiak,Walter Slezak,William Bendix,26471,
"https://m.media-amazon.com/images/M/MV5BMTY5ODAzMTcwOF5BMl5BanBnXkFtZTcwMzYxNDYyNA@@._V1_UX67_CR0,0,67,98_AL_.jpg",The 39 Steps,1935,,86 min,"Crime, Mystery, Thriller",7.6,"A man in London tries to help a counter-espionage Agent. But when the Agent is killed, and the man stands accused, he must go on the run to save himself and stop a spy ring which is trying to steal top secret information.",93,Alfred Hitchcock,Robert Donat,Madeleine Carroll,Lucie Mannheim,Godfrey Tearle,51853,
