Poster_Link,Series_Title,Released_Year,Certificate,Runtime,Genre,IMDB_Rating,Overview,Meta_score,Director,Star1,Star2,Star3,Star4,No_of_Votes,Gross
"https://m.media-amazon.com/images/M/MV5BNGMxZjFkN2EtMDRiMS00ZTBjLWI0M2MtZWUyYjFhZGViZDJlXkEyXkFqcGdeQXVyMTMxODk2OTU@._V1_UX67_CR0,0,67,98_AL_.jpg",El cuerpo,2012,,112 min,"Mystery, Thriller",7.6,A detective searches for the body of a femme fatale which has gone missing from a morgue.,,Oriol Paulo,Jose Coronado,Hugo Silva,Belén Rueda,Aura Garrido,57549,
"https://m.media-amazon.com/images/M/MV5BZGIxODNjM2YtZjA5Mi00MjA5LTk2YjItODE0OWI5NThjNTBmXkEyXkFqcGdeQXVyNzQ1ODk3MTQ@._V1_UX67_CR0,0,67,98_AL_.jpg",Serbuan maut,2011,A,101 min,"Action, Thriller",7.6,A S.W.A.T. team becomes trapped in a tenement run by a ruthless mobster and his army of killers and thugs.,73,Gareth Evans,Iko Uwais,Ananda George,Ray Sahetapy,Donny Alamsyah,190531,"4,105,123"
"https://m.media-amazon.com/images/M/MV5BMjMxNjU0ODU5Ml5BMl5BanBnXkFtZTcwNjI4MzAyOA@@._V1_UX67_CR0,0,67,98_AL_.jpg",End of Watch,2012,A,109 min,"Action, Crime, Drama",7.6,"Shot documentary-style, this film follows the daily grind of two young police officers in LA who are partners and friends, and what happens when they meet criminal forces greater than themselves.",68,David Ayer,Jake Gyllenhaal,Michael Peña,Anna Kendrick,America Ferrera,228132,"41,003,371"
"https://m.media-amazon.com/images/M/MV5BZDY3ZGI0ZDAtMThlNy00MzAxLTg4YjAtNjkwYTkxNmQ4MjdlXkEyXkFqcGdeQXVyMTMxODk2OTU@._V1_UX67_CR0,0,67,98_AL_.jpg",Kari-gurashi no Arietti,2010,U,94 min,"Animation, Adventure, Family",7.6,"The Clock family are four-inch-tall people who live anonymously in another family's residence, borrowing simple items to make their home. Life changes for the Clocks when their teenage daughter, Arrietty, is discovered.",80,Hiromasa Yonebayashi,Amy Poehler,Mirai Shida,Ryûnosuke Kamiki,Tatsuya Fujiwara,80939,"19,202,743"
"https://m.media-amazon.com/images/M/MV5BNmE5ZmE3OGItNTdlNC00YmMxLWEzNjctYzAwOGQ5ODg0OTI0XkEyXkFqcGdeQXVyMTMxODk2OTU@._V1_UX67_CR0,0,67,98_AL_.jpg",A Star Is Born,2018,UA,136 min,"Drama, Music, Romance",7.6,A musician helps a young singer find fame as age and alcoholism send his own career into a downward spiral.,88,Bradley Cooper,Lady Gaga,Bradley Cooper,Sam Elliott,Greg Grunberg,334312,"215,288,866"
"https://m.media-amazon.com/images/M/MV5BODhkZDIzNjgtOTA5ZS00MmMzLWFkNjYtM2Y2MzFjN2FkNjAzL2ltYWdlXkEyXkFqcGdeQXVyNTAyODkwOQ@@._V1_UY98_CR1,0,67,98_AL_.jpg",True Grit,2010,PG-13,110 min,"Drama, Western",7.6,A stubborn teenager enlists the help of a tough U.S. Marshal to track down her father's murderer.,80,Ethan Coen,Joel Coen,Jeff Bridges,Matt Damon,Hailee Steinfeld,311822,"171,243,005"
"https://m.media-amazon.com/images/M/MV5BNDY2OTE5MzE0Nl5BMl5BanBnXkFtZTcwNDAyOTc2NA@@._V1_UX67_CR0,0,67,98_AL_.jpg",Hævnen,2010,R,118 min,"Drama, Romance",7.6,"The lives of two Danish families cross each other, and an extraordinary but risky friendship comes into bud. But loneliness, frailty and sorrow lie in wait.",65,Susanne Bier,Mikael Persbrandt,Trine Dyrholm,Markus Rygaard,Wil Johnson,38491,"1,008,098"
"https://m.media-amazon.com/images/M/MV5BMTY3NjY0MTQ0Nl5BMl5BanBnXkFtZTcwMzQ2MTc0Mw@@._V1_UX67_CR0,0,67,98_AL_.jpg",Despicable Me,2010,U,95 min,"Animation, Comedy, Crime",7.6,"When a criminal mastermind uses a trio of orphan girls as pawns for a grand scheme, he finds their love is profoundly changing him for the better.",72,Pierre Coffin,Chris Renaud,Steve Carell,Jason Segel,Russell Brand,500851,"251,513,985"
"https://m.media-amazon.com/images/M/MV5BNjg3ODQyNTIyN15BMl5BanBnXkFtZTcwMjUzNzM5NQ@@._V1_UX67_CR0,0,67,98_AL_.jpg",50/50,2011,R,100 min,"Comedy, Drama, Romance",7.6,"Inspired by a true story, a comedy centered on a 27-year-old guy who learns of his cancer diagnosis and his subsequent struggle to beat the disease.",72,Jonathan Levine,Joseph Gordon-Levitt,Seth Rogen,Anna Kendrick,Bryce Dallas Howard,315426,"35,014,192"
"https://m.media-amazon.com/images/M/MV5BMTMzNzEzMDYxM15BMl5BanBnXkFtZTcwMTc0NTMxMw@@._V1_UX67_CR0,0,67,98_AL_.jpg",Kick-Ass,2010,UA,117 min,"Action, Comedy, Crime",7.6,"Dave Lizewski is an unnoticed high school student and comic book fan who one day decides to become a superhero, even though he has no powers, training or meaningful reason to do so.",66,Matthew Vaughn,Aaron Taylor-Johnson,Nicolas Cage,Chloë Grace Moretz,Garrett M. Brown,524081,"48,071,303"
"https://m.media-amazon.com/images/M/MV5BMjI2ODE4ODAtMDA3MS00ODNkLTg4N2EtOGU0YjZmNGY4NjZlXkEyXkFqcGdeQXVyMTY5MDE5NA@@._V1_UY98_CR0,0,67,98_AL_.jpg",Celda 211,2009,,113 min,"Action, Adventure, Crime",7.6,"The story of two men on different sides of a prison riot -- the inmate leading the rebellion and the young guard trapped in the revolt, who poses as a prisoner in a desperate attempt to survive the ordeal.",,Daniel Monzón,Luis Tosar,Alberto Ammann,Antonio Resines,Manuel Morón,63882,
"https://m.media-amazon.com/images/M/MV5BMjAxOTU3Mzc1M15BMl5BanBnXkFtZTcwMzk1ODUzNg@@._V1_UX67_CR0,0,67,98_AL_.jpg",Moneyball,2011,PG-13,133 min,"Biography, Drama, Sport",7.6,Oakland A's general manager Billy Beane's successful attempt to assemble a baseball team on a lean budget by employing computer-generated analysis to acquire new players.,87,Bennett Miller,Brad Pitt,Robin Wright,Jonah Hill,Philip Seymour Hoffman,369529,"75,605,492"
"https://m.media-amazon.com/images/M/MV5BYmFmNjY5NDYtZjlhNi00YjQ5LTgzNzctNWRiNWUzNmIyNjc4XkEyXkFqcGdeQXVyMTMxODk2OTU@._V1_UY98_CR0,0,67,98_AL_.jpg",La piel que habito,2011,R,120 min,"Drama, Horror, Thriller",7.6,"A brilliant plastic surgeon, haunted by past tragedies, creates a type of synthetic skin that withstands any kind of damage. His guinea pig: a mysterious and volatile woman who holds the key to his obsession.",70,Pedro Almodóvar,Antonio Banderas,Elena Anaya,Jan Cornet,Marisa Paredes,138959,"3,185,812"
"https://m.media-amazon.com/images/M/MV5BMTU5MDg0NTQ1N15BMl5BanBnXkFtZTcwMjA4Mjg3Mg@@._V1_UY98_CR1,0,67,98_AL_.jpg",Zombieland,2009,A,88 min,"Adventure, Comedy, Fantasy",7.6,"A shy student trying to reach his family in Ohio, a gun-toting tough guy trying to find the last Twinkie, and a pair of sisters trying to get to an amusement park join forces to travel across a zombie-filled America.",73,Ruben Fleischer,Jesse Eisenberg,Emma Stone,Woody Harrelson,Abigail Breslin,520041,"75,590,286"
"https://m.media-amazon.com/images/M/MV5BMzc0ZmUyZjAtZThkMi00ZDY5LTg5YjctYmUwM2FiYjMyMDI5XkEyXkFqcGdeQXVyMTMxODk2OTU@._V1_UX67_CR0,0,67,98_AL_.jpg",Die Welle,2008,,107 min,"Drama, Thriller",7.6,A high school teacher's experiment to demonstrate to his students what life is like under a dictatorship spins horribly out of control when he forms a social unit with a life of its own.,,Dennis Gansel,Jürgen Vogel,Frederick Lau,Max Riemelt,Jennifer Ulrich,102742,
"https://m.media-amazon.com/images/M/MV5BMTg0NjEwNjUxM15BMl5BanBnXkFtZTcwMzk0MjQ5Mg@@._V1_UX67_CR0,0,67,98_AL_.jpg",Sherlock Holmes,2009,PG-13,128 min,"Action, Adventure, Mystery",7.6,Detective Sherlock Holmes and his stalwart partner Watson engage in a battle of wits and brawn with a nemesis whose plot is a threat to all of England.,57,Guy Ritchie,Robert Downey Jr.,Jude Law,Rachel McAdams,Mark Strong,583158,"209,028,679"
"https://m.media-amazon.com/images/M/MV5BMjEzOTE3ODM3OF5BMl5BanBnXkFtZTcwMzYyODI4Mg@@._V1_UX67_CR0,0,67,98_AL_.jpg",The Blind Side,2009,UA,129 min,"Biography, Drama, Sport",7.6,"The story of Michael Oher, a homeless and traumatized boy who became an All-American football player and first-round NFL draft pick with the help of a caring woman and her family.",53,John Lee Hancock,Quinton Aaron,Sandra Bullock,Tim McGraw,Jae Head,293266,"255,959,475"
"https://m.media-amazon.com/images/M/MV5BMTIzNTg3NzkzNV5BMl5BanBnXkFtZTcwNzMwMjU2MQ@@._V1_UX67_CR0,0,67,98_AL_.jpg",The Visitor,2007,PG-13,104 min,Drama,7.6,A college professor travels to New York City to attend a conference and finds a young couple living in his apartment.,79,Tom McCarthy,Richard Jenkins,Haaz Sleiman,Danai Gurira,Hiam Abbass,41544,"9,422,422"
"https://m.media-amazon.com/images/M/MV5BMTU0NzY0MTY5OF5BMl5BanBnXkFtZTcwODY3MDEwMg@@._V1_UY98_CR3,0,67,98_AL_.jpg",Seven Pounds,2008,UA,123 min,Drama,7.6,A man with a fateful secret embarks on an extraordinary journey of redemption by forever changing the lives of seven strangers.,36,Gabriele Muccino,Will Smith,Rosario Dawson,Woody Harrelson,Michael Ealy,286770,"69,951,824"
"https://m.media-amazon.com/images/M/MV5BMTcwMzU0OTY3NF5BMl5BanBnXkFtZTYwNzkwNjg2._V1_UX67_CR0,0,67,98_AL_.jpg",Eastern Promises,2007,R,100 min,"Action, Crime, Drama",7.6,A teenager who dies during childbirth leaves clues in her journal that could tie her child to a rape involving a violent Russian mob family.,82,David Cronenberg,Naomi Watts,Viggo Mortensen,Armin Mueller-Stahl,Josef Altin,227760,"17,114,882"
"https://m.media-amazon.com/images/M/MV5BMjkyMTE1OTYwNF5BMl5BanBnXkFtZTcwMDIxODYzMw@@._V1_UX67_CR0,0,67,98_AL_.jpg",Stardust,2007,U,127 min,"Adventure, Family, Fantasy",7.6,"In a countryside town bordering on a magical land, a young man makes a promise to his beloved that he'll retrieve a fallen star by venturing into the magical realm.",66,Matthew Vaughn,Charlie Cox,Claire Danes,Sienna Miller,Ian McKellen,255036,"38,634,938"
"https://m.media-amazon.com/images/M/MV5BMjEzMjEzNTIzOF5BMl5BanBnXkFtZTcwMTg2MjAyMw@@._V1_UY98_CR0,0,67,98_AL_.jpg",The Secret of Kells,2009,,71 min,"Animation, Adventure, Family",7.6,"A young boy in a remote medieval outpost under siege from barbarian raids is beckoned to adventure when a celebrated master illuminator arrives with an ancient book, brimming with secret wisdom and powers.",81,Tomm Moore,Nora Twomey,Evan McGuire,Brendan Gleeson,Mick Lally,31779,"686,383"
"https://m.media-amazon.com/images/M/MV5BYjc4MjA2ZDgtOGY3YS00NDYzLTlmNTEtYWMxMzcwZjgzYWNjXkEyXkFqcGdeQXVyMTQxNzMzNDI@._V1_UX67_CR0,0,67,98_AL_.jpg",Inside Man,2006,R,129 min,"Crime, Drama, Mystery",7.6,"A police detective, a bank robber, and a high-power broker enter high-stakes negotiations after the criminal's brilliant heist spirals into a hostage situation.",76,Spike Lee,Denzel Washington,Clive Owen,Jodie Foster,Christopher Plummer,339757,"88,513,495"
"https://m.media-amazon.com/images/M/MV5BYmM2NDNiNGItMTRhMi00ZDA2LTgzOWMtZTE2ZjFhMDQ2M2U5XkEyXkFqcGdeQXVyNTAyODkwOQ@@._V1_UX67_CR0,0,67,98_AL_.jpg",Gone Baby Gone,2007,R,114 min,"Crime, Drama, Mystery",7.6,"Two Boston area detectives investigate a little girl's kidnapping, which ultimately turns into a crisis both professionally and personally.",72,Ben Affleck,Morgan Freeman,Ed Harris,Casey Affleck,Michelle Monaghan,250590,"20,300,218"
"https://m.media-amazon.com/images/M/MV5BOTBmZDZkNWYtODIzYi00N2Y4LWFjMmMtNmM1OGYyNGVhYzUzXkEyXkFqcGdeQXVyNTAyODkwOQ@@._V1_UX67_CR0,0,67,98_AL_.jpg",La Vie En Rose,2007,PG-13,140 min,"Biography, Drama, Music",7.6,"Biopic of the iconic French singer Édith Piaf. Raised by her grandmother in a brothel, she was discovered while singing on a street corner at the age of 19. Despite her success, Piaf's life was filled with tragedy.",66,Olivier Dahan,Marion Cotillard,Sylvie Testud,Pascal Greggory,Emmanuelle Seigner,82781,"10,301,706"
"https://m.media-amazon.com/images/M/MV5BMTI5MjA2Mzk2M15BMl5BanBnXkFtZTcwODY1MDUzMQ@@._V1_UX67_CR0,0,67,98_AL_.jpg",Huo Yuan Jia,2006,PG-13,104 min,"Action, Biography, Drama",7.6,"A biography of Chinese Martial Arts Master Huo Yuanjia, who is the founder and spiritual guru of the Jin Wu Sports Federation.",70,Ronny Yu,Jet Li,Li Sun,Yong Dong,Yun Qu,72863,"24,633,730"
"https://m.media-amazon.com/images/M/MV5BY2VkMzZlZDAtNTkzNS00MDIzLWFmOTctMWQwZjQ1OWJiYzQ1XkEyXkFqcGdeQXVyNTIzOTk5ODM@._V1_UY98_CR1,0,67,98_AL_.jpg",The Illusionist,2006,U,110 min,"Drama, Fantasy, Mystery",7.6,"In turn-of-the-century Vienna, a magician uses his abilities to secure the love of a woman far above his social standing.",68,Neil Burger,Edward Norton,Jessica Biel,Paul Giamatti,Rufus Sewell,354728,"39,868,642"
"https://m.media-amazon.com/images/M/MV5BMTI5Mzk1MDc2M15BMl5BanBnXkFtZTcwMjIzMDA0MQ@@._V1_UX67_CR0,0,67,98_AL_.jpg",Dead Man's Shoes,2004,,90 min,"Crime, Drama, Thriller",7.6,A disaffected soldier returns to his hometown to get even with the thugs who brutalized his mentally-challenged brother years ago.,52,Shane Meadows,Paddy Considine,Gary Stretch,Toby Kebbell,Stuart Wolfenden,49728,"6,013"
"https://m.media-amazon.com/images/M/MV5BNzU3NDg4NTAyNV5BMl5BanBnXkFtZTcwOTg2ODg1Mg@@._V1_UX67_CR0,0,67,98_AL_.jpg",Harry Potter and the Half-Blood Prince,2009,UA,153 min,"Action, Adventure, Family",7.6,"As Harry Potter begins his sixth year at Hogwarts, he discovers an old book marked as ""the property of the Half-Blood Prince"" and begins to learn more about Lord Voldemort's dark past.",78,David Yates,Daniel Radcliffe,Emma Watson,Rupert Grint,Michael Gambon,474827,"301,959,197"
"https://m.media-amazon.com/images/M/MV5BNWMxYTZlOTUtZDExMi00YzZmLTkwYTMtZmM2MmRjZmQ3OGY4XkEyXkFqcGdeQXVyMTAwMzUyMzUy._V1_UX67_CR0,0,67,98_AL_.jpg",300,2006,A,117 min,"Action, Drama",7.6,King Leonidas of Sparta and a force of 300 men fight the Persians at Thermopylae in 480 B.C.,52,Zack Snyder,Gerard Butler,Lena Headey,David Wenham,Dominic West,732876,"210,614,939"
"https://m.media-amazon.com/images/M/MV5BMjRjOTMwMDEtNTY4NS00OWRjLWI4ZWItZDgwYmZhMzlkYzgxXkEyXkFqcGdeQXVyODIxOTg5MTc@._V1_UY98_CR1,0,67,98_AL_.jpg",Match Point,2005,R,124 min,"Drama, Romance, Thriller",7.6,"At a turning point in his life, a former tennis pro falls for an actress who happens to be dating his friend and soon-to-be brother-in-law.",72,Woody Allen,Scarlett Johansson,Jonathan Rhys Meyers,Emily Mortimer,Matthew Goode,206294,"23,089,926"
"https://m.media-amazon.com/images/M/MV5BY2IzNGNiODgtOWYzOS00OTI0LTgxZTUtOTA5OTQ5YmI3NGUzXkEyXkFqcGdeQXVyNjU0OTQ0OTY@._V1_UX67_CR0,0,67,98_AL_.jpg",Watchmen,2009,A,162 min,"Action, Drama, Mystery",7.6,"In 1985 where former superheroes exist, the murder of a colleague sends active vigilante Rorschach into his own sprawling investigation, uncovering something that could completely change the course of history as we know it.",56,Zack Snyder,Jackie Earle Haley,Patrick Wilson,Carla Gugino,Malin Akerman,500799,"107,509,799"
"https://m.media-amazon.com/images/M/MV5BMTYzZWE3MDAtZjZkMi00MzhlLTlhZDUtNmI2Zjg3OWVlZWI0XkEyXkFqcGdeQXVyNDk3NzU2MTQ@._V1_UX67_CR0,0,67,98_AL_.jpg",Lord of War,2005,R,122 min,"Action, Crime, Drama",7.6,An arms dealer confronts the morality of his work as he is being chased by an INTERPOL Agent.,62,Andrew Niccol,Nicolas Cage,Ethan Hawke,Jared Leto,Bridget Moynahan,294140,"24,149,632"
"https://m.media-amazon.com/images/M/MV5BMzQ2ZTBhNmEtZDBmYi00ODU0LTgzZmQtNmMxM2M4NzM1ZjE4XkEyXkFqcGdeQXVyNjE5MjUyOTM@._V1_UX67_CR0,0,67,98_AL_.jpg",Saw,2004,UA,103 min,"Horror, Mystery, Thriller",7.6,"Two strangers awaken in a room with no recollection of how they got there, and soon discover they're pawns in a deadly game perpetrated by a notorious serial killer.",46,James Wan,Cary Elwes,Leigh Whannell,Danny Glover,Ken Leung,379020,"56,000,369"
"https://m.media-amazon.com/images/M/MV5BMjA0MjIyOTI3MF5BMl5BanBnXkFtZTcwODM5NTY5MQ@@._V1_UX67_CR0,0,67,98_AL_.jpg","Synecdoche, New York",2008,R,124 min,Drama,7.6,"A theatre director struggles with his work, and the women in his life, as he creates a life-size replica of New York City inside a warehouse as part of his new play.",67,Charlie Kaufman,Philip Seymour Hoffman,Samantha Morton,Michelle Williams,Catherine Keener,83158,"3,081,925"
"https://m.media-amazon.com/images/M/MV5BMTgxMjQ4NzE5OF5BMl5BanBnXkFtZTcwNzkwOTkyMQ@@._V1_UX67_CR0,0,67,98_AL_.jpg",Mysterious Skin,2004,R,105 min,Drama,7.6,"A teenage hustler and a young man obsessed with alien abductions cross paths, together discovering a horrible, liberating truth.",73,Gregg Araki,Brady Corbet,Joseph Gordon-Levitt,Elisabeth Shue,Chase Ellison,65939,"697,181"
"https://m.media-amazon.com/images/M/MV5BNjIwOGJhY2QtMTA5Yi00MDhlLWE5OTgtYmIzZDNlM2UwZjMyXkEyXkFqcGdeQXVyNTA4NzY1MzY@._V1_UX67_CR0,0,67,98_AL_.jpg",Jeux d'enfants,2003,R,93 min,"Comedy, Drama, Romance",7.6,"As adults, best friends Julien and Sophie continue the odd game they started as children -- a fearless competition to outdo one another with daring and outrageous stunts. While they often act out to relieve one another's pain, their game might be a way to avoid the fact that they are truly meant for one another.",45,Yann Samuell,Guillaume Canet,Marion Cotillard,Thibault Verhaeghe,Joséphine Lebas-Joly,67360,"548,707"
"https://m.media-amazon.com/images/M/MV5BZWI4ZTgwMzktNjk3Yy00OTlhLTg3YTAtMTA1MWVlMWJiOTRiXkEyXkFqcGdeQXVyMTAwMzUyOTc@._V1_UX67_CR0,0,67,98_AL_.jpg",Un long dimanche de fiançailles,2004,U,133 min,"Drama, Mystery, Romance",7.6,"Tells the story of a young woman's relentless search for her fiancé, who has disappeared from the trenches of the Somme during World War One.",76,Jean-Pierre Jeunet,Audrey Tautou,Gaspard Ulliel,Jodie Foster,Dominique Pinon,70925,"6,167,817"
"https://m.media-amazon.com/images/M/MV5BMTUzNDgyMzg3Ml5BMl5BanBnXkFtZTcwMzIxNTAwMQ@@._V1_UX67_CR0,0,67,98_AL_.jpg",The Station Agent,2003,R,89 min,"Comedy, Drama",7.6,"When his only friend dies, a man born with dwarfism moves to rural New Jersey to live a life of solitude, only to meet a chatty hot dog vendor and a woman dealing with her own personal loss.",81,Tom McCarthy,Peter Dinklage,Patricia Clarkson,Bobby Cannavale,Paul Benjamin,67370,"5,739,376"
"https://m.media-amazon.com/images/M/MV5BMjA4MjI2OTM5N15BMl5BanBnXkFtZTcwNDA1NjUzMw@@._V1_UX67_CR0,0,67,98_AL_.jpg",21 Grams,2003,UA,124 min,"Crime, Drama, Thriller",7.6,"A freak accident brings together a critically ill mathematician, a grieving mother, and a born-again ex-con.",70,Alejandro G. Iñárritu,Sean Penn,Benicio Del Toro,Naomi Watts,Danny Huston,224545,"16,290,476"
"https://m.media-amazon.com/images/M/MV5BYmNlNDVjMWUtZDZjNS00YTBmLWE3NGUtNDcxMzE0YTQ2ODMxXkEyXkFqcGdeQXVyMTMxODk2OTU@._V1_UX67_CR0,0,67,98_AL_.jpg",Boksuneun naui geot,2002,R,129 min,"Crime, Drama, Thriller",7.6,"A recently laid off factory worker kidnaps his former boss' friend's daughter, hoping to use the ransom money to pay for his sister's kidney transplant.",56,Chan-wook Park,Kang-ho Song,Shin Ha-kyun,Bae Doona,Ji-Eun Lim,62659,"45,289"
"https://m.media-amazon.com/images/M/MV5BMTMxNzYzNzUzMV5BMl5BanBnXkFtZTYwNjcwMjE3._V1_UX67_CR0,0,67,98_AL_.jpg",Finding Neverland,2004,U,106 min,"Biography, Drama, Family",7.6,The story of Sir J.M. Barrie's friendship with a family who inspired him to create Peter Pan.,67,Marc Forster,Johnny Depp,Kate Winslet,Julie Christie,Radha Mitchell,198677,"51,680,613"
"https://m.media-amazon.com/images/M/MV5BNmE0YjdlYTktMTU4Ni00Mjk2LWI3NWMtM2RjNmFiOTk4YjYxL2ltYWdlXkEyXkFqcGdeQXVyNTAyODkwOQ@@._V1_UY98_CR1,0,67,98_AL_.jpg",25th Hour,2002,R,135 min,Drama,7.6,"Cornered by the DEA, convicted New York drug dealer Montgomery Brogan reevaluates his life in the 24 remaining hours before facing a seven-year jail term.",68,Spike Lee,Edward Norton,Barry Pepper,Philip Seymour Hoffman,Rosario Dawson,169708,"13,060,843"
"https://m.media-amazon.com/images/M/MV5BODNiZmY2MWUtMjFhMy00ZmM2LTg2MjYtNWY1OTY5NGU2MjdjL2ltYWdlXkEyXkFqcGdeQXVyNTAyODkwOQ@@._V1_UY98_CR0,0,67,98_AL_.jpg",The Butterfly Effect,2004,U,113 min,"Drama, Sci-Fi, Thriller",7.6,"Evan Treborn suffers blackouts during significant events of his life. As he grows up, he finds a way to remember these lost memories and a supernatural way to alter his life by reading his journal.",30,Eric Bress,J. Mackye Gruber,Ashton Kutcher,Amy Smart,Melora Walters,451479,"57,938,693"
"https://m.media-amazon.com/images/M/MV5BYTFkM2ViMmQtZmI5NS00MjQ2LWEyN2EtMTI1ZmNlZDU3MTZjXkEyXkFqcGdeQXVyNjU0OTQ0OTY@._V1_UX67_CR0,0,67,98_AL_.jpg",28 Days Later...,2002,A,113 min,"Drama, Horror, Sci-Fi",7.6,"Four weeks after a mysterious, incurable virus spreads throughout the UK, a handful of survivors try to find sanctuary.",73,Danny Boyle,Cillian Murphy,Naomie Harris,Christopher Eccleston,Alex Palmer,376853,"45,064,915"
"https://m.media-amazon.com/images/M/MV5BMDc2MGYwYzAtNzE2Yi00YmU3LTkxMDUtODk2YjhiNDM5NDIyXkEyXkFqcGdeQXVyMTEwNDU1MzEy._V1_UX67_CR0,0,67,98_AL_.jpg",Batoru rowaiaru,2000,,114 min,"Action, Adventure, Drama",7.6,"In the future, the Japanese government captures a class of ninth-grade students and forces them to kill each other under the revolutionary ""Battle Royale"" act.",81,Kinji Fukasaku,Tatsuya Fujiwara,Aki Maeda,Tarô Yamamoto,Takeshi Kitano,169091,
"https://m.media-amazon.com/images/M/MV5BYmUzODQ5MGItZTZlNy00MDBhLWIxMmItMjg4Y2QyNDFlMWQ2XkEyXkFqcGdeQXVyMTMxODk2OTU@._V1_UX67_CR0,0,67,98_AL_.jpg",The Royal Tenenbaums,2001,A,110 min,"Comedy, Drama",7.6,The eccentric members of a dysfunctional family reluctantly gather under the same roof for various reasons.,76,Wes Anderson,Gene Hackman,Gwyneth Paltrow,Anjelica Huston,Ben Stiller,266842,"52,364,010"
"https://m.media-amazon.com/images/M/MV5BNDhjMzc3ZTgtY2Y4MC00Y2U3LWFiMDctZGM3MmM4N2YzNDQ5XkEyXkFqcGdeQXVyMTQxNzMzNDI@._V1_UX67_CR0,0,67,98_AL_.jpg",Y tu mamá también,2001,A,106 min,Drama,7.6,"In Mexico, two teenage boys and an attractive older woman embark on a road trip and learn a thing or two about life, friendship, sex, and each other.",88,Alfonso Cuarón,Maribel Verdú,Gael García Bernal,Daniel Giménez Cacho,Ana López Mercado,115827,"13,622,333"
"https://m.media-amazon.com/images/M/MV5BNjQ3NWNlNmQtMTE5ZS00MDdmLTlkZjUtZTBlM2UxMGFiMTU3XkEyXkFqcGdeQXVyNjUwNzk3NDc@._V1_UX67_CR0,0,67,98_AL_.jpg",Harry Potter and the Sorcerer's Stone,2001,U,152 min,"Adventure, Family, Fantasy",7.6,"An orphaned boy enrolls in a school of wizardry, where he learns the truth about himself, his family and the terrible evil that haunts the magical world.",64,Chris Columbus,Daniel Radcliffe,Rupert Grint,Richard Harris,Maggie Smith,658185,"317,575,550"
"https://m.media-amazon.com/images/M/MV5BMTAxMDE4Mzc3ODNeQTJeQWpwZ15BbWU4MDY2Mjg4MDcx._V1_UX67_CR0,0,67,98_AL_.jpg",The Others,2001,PG-13,101 min,"Horror, Mystery, Thriller",7.6,A woman who lives in her darkened old family house with her two photosensitive children becomes convinced that the home is haunted.,74,Alejandro Amenábar,Nicole Kidman,Christopher Eccleston,Fionnula Flanagan,Alakina Mann,337651,"96,522,687"
"https://m.media-amazon.com/images/M/MV5BYjg5ZDkzZWEtZDQ2ZC00Y2ViLThhMzYtMmIxZDYzYTY2Y2Y2XkEyXkFqcGdeQXVyODAwMTU1MTE@._V1_UY98_CR1,0,67,98_AL_.jpg",Blow,2001,R,124 min,"Biography, Crime, Drama",7.6,"The story of how George Jung, along with the Medellín Cartel headed by Pablo Escobar, established the American cocaine market in the 1970s in the United States.",52,Ted Demme,Johnny Depp,Penélope Cruz,Franka Potente,Rachel Griffiths,240714,"52,990,775"
"https://m.media-amazon.com/images/M/MV5BYWFlY2E3ODQtZWNiNi00ZGU4LTkzNWEtZTQ2ZTViMWRhYjIzL2ltYWdlXkEyXkFqcGdeQXVyNTAyODkwOQ@@._V1_UX67_CR0,0,67,98_AL_.jpg",Enemy at the Gates,2001,A,131 min,"Drama, History, War",7.6,A Russian and a German sniper play a game of cat-and-mouse during the Battle of Stalingrad.,53,Jean-Jacques Annaud,Jude Law,Ed Harris,Joseph Fiennes,Rachel Weisz,243729,"51,401,758"
"https://m.media-amazon.com/images/M/MV5BZTI3YzZjZjEtMDdjOC00OWVjLTk0YmYtYzI2MGMwZjFiMzBlXkEyXkFqcGdeQXVyMTQxNzMzNDI@._V1_UX67_CR0,0,67,98_AL_.jpg",Minority Report,2002,A,145 min,"Action, Crime, Mystery",7.6,"In a future where a special police unit is able to arrest murderers before they commit their crimes, an officer from that unit is himself accused of a future murder.",80,Steven Spielberg,Tom Cruise,Colin Farrell,Samantha Morton,Max von Sydow,508417,"132,072,926"
"https://m.media-amazon.com/images/M/MV5BMTA3OTYxMzg0MDFeQTJeQWpwZ15BbWU4MDY1MjY0MTEx._V1_UX67_CR0,0,67,98_AL_.jpg",The Hurricane,1999,R,146 min,"Biography, Drama, Sport",7.6,"The story of Rubin 'Hurricane' Carter, a boxer wrongly imprisoned for murder, and the people who aided in his fight to prove his innocence.",74,Norman Jewison,Denzel Washington,Vicellous Shannon,Deborah Kara Unger,Liev Schreiber,91557,"50,668,906"
"https://m.media-amazon.com/images/M/MV5BZTM2ZGJmNjQtN2UyOS00NjcxLWFjMDktMDE2NzMyNTZlZTBiXkEyXkFqcGdeQXVyNzkwMjQ5NzM@._V1_UX67_CR0,0,67,98_AL_.jpg",American Psycho,2000,A,101 min,"Comedy, Crime, Drama",7.6,"A wealthy New York City investment banking executive, Patrick Bateman, hides his alternate psychopathic ego from his co-workers and friends as he delves deeper into his violent, hedonistic fantasies.",64,Mary Harron,Christian Bale,Justin Theroux,Josh Lucas,Bill Sage,490062,"15,070,285"
"https://m.media-amazon.com/images/M/MV5BMmU5ZjFmYjQtYmNjZC00Yjk4LWI1ZTQtZDJiMjM0YjQyNDU0L2ltYWdlL2ltYWdlXkEyXkFqcGdeQXVyMTQxNzMzNDI@._V1_UX67_CR0,0,67,98_AL_.jpg",Lola rennt,1998,UA,81 min,"Crime, Drama, Thriller",7.6,"After a botched money delivery, Lola has 20 minutes to come up with 100,000 Deutschmarks.",77,Tom Tykwer,Franka Potente,Moritz Bleibtreu,Herbert Knaup,Nina Petri,188317,"7,267,585"
"https://m.media-amazon.com/images/M/MV5BYjEzMTM2NjAtNWFmZC00MTVlLTgyMmQtMGQyNTFjZDk5N2NmXkEyXkFqcGdeQXVyNzQ1ODk3MTQ@._V1_UX67_CR0,0,67,98_AL_.jpg",The Thin Red Line,1998,A,170 min,"Drama, War",7.6,"Adaptation of James Jones' autobiographical 1962 novel, focusing on the conflict at Guadalcanal during the second World War.",78,Terrence Malick,Jim Caviezel,Sean Penn,Nick Nolte,Kirk Acevedo,172710,"36,400,491"
"https://m.media-amazon.com/images/M/MV5BODkxNGQ1NWYtNzg0Ny00Yjg3LThmZTItMjE2YjhmZTQ0ODY5XkEyXkFqcGdeQXVyMTQxNzMzNDI@._V1_UX67_CR0,0,67,98_AL_.jpg",Mulan,1998,U,88 min,"Animation, Adventure, Family",7.6,"To save her father from death in the army, a young maiden secretly goes in his place and becomes one of China's greatest heroines in the process.",71,Tony Bancroft,Barry Cook,Ming-Na Wen,Eddie Murphy,BD Wong,256906,"120,620,254"
